{
  "schema_version": 1,
  "bundle_id": "2026-08-28-real-projects-v1",
  "created_at": "2026-08-28T20:30:00Z",
  "description": "Nine real explanation cases from SIDERIUS and SciTra Runtime: five SIDERIUS PR/issues, three SciTra Runtime PR/issues, and the SIDERIUS README.",
  "cases": [
    {
      "id": "siderius-pr-248",
      "title": "SIDERIUS PR #248 — composed path no longer inherits TIDMAD semantics",
      "source": {
        "kind": "pr",
        "url": "https://github.com/Galileo-Sandbox/SIDERIUS/pull/248",
        "revision": "merge 1555417464bb48982b813458c08a113be60c6c37",
        "snapshot": "Merged PR. A composed run previously inherited TIDMAD-specific values and prompt science in several paths: data scope, health configuration, run-invariant identity, deliverable naming, planner/proposer/implementor prompts, and plugin handling. The PR introduces typed composition projections and task-owned prompt blocks, removes implicit TIDMAD fallbacks on the owned surfaces, preserves legacy uncomposed behavior byte-for-byte, and adds fail-closed guards. Because the TIDMAD manifest gains proposal_blocks and implementor_blocks, its semantic fingerprint changes; an older composed workspace is intentionally refused on resume. Gates passed. CAP-SCOPE and external child loading remain later work."
      },
      "request": "给熟悉 agent/ML workflow、但没跟过 Step 12 设计历史的工程师解释这个 PR 到底改了什么，为什么重要。",
      "audience": "cross-domain senior software/ML engineer unfamiliar with SIDERIUS design history",
      "depth": 2,
      "must_preserve": [
        "the defect was implicit TIDMAD semantics in composed runs, not merely duplicated code",
        "legacy uncomposed behavior remains compatible",
        "typed composition and task-owned prompt blocks change authority ownership",
        "semantic fingerprint change intentionally makes old composed resumes fail closed",
        "later extensibility work is explicitly not claimed"
      ],
      "baseline": {
        "text": "该 PR 完成了 composed path 的语义闭包，消除了多个执行与 prompt surface 对 TIDMAD 默认值的隐式依赖。实现上增加 typed composition projection，并把 proposal、implementor 等 prompt science 转移到 task-owned blocks；同时修正 scope、health materialization、run-invariant fingerprint、deliverable naming 和 plugin validation 等路径。未组合的 Regime-A 保持 byte compatibility。由于 TIDMAD manifest 新增了 proposal_blocks 和 implementor_blocks，其 semantic fingerprint 会变化，因此旧 composed workspace 的 resume 会 fail closed。PR 通过了 prompt 与 lifecycle 两类 gate，但不包含 CAP-SCOPE 和 external child loading。",
        "provenance": {"host":"codex","model":"gpt-5","generated_at":"2026-08-28T20:30:00Z","skill_mode":"baseline","notes":"Matched-source baseline; no dongbei-explainer project skill applied."}
      },
      "full": {
        "text": "先看原来的问题：你明明启动的是一个 composed task，系统有些地方却还会偷偷按 TIDMAD 来办。比如数据范围按 TIDMAD 算，health config 又按 TIDMAD 生成，给 planner 和 implementor 的 prompt 里也夹着 TIDMAD 的任务知识。表面上 composition 已经接上了，实际上底下还有好几根线写死在老任务上。\n\n这个 PR 干的核心事，是把“这次 run 到底属于哪个 task、该带哪些语义”收回到一个明确的 composition authority。执行侧通过 typed composition projection 把 scope、health、run identity 等信息送到真正使用它们的地方；LLM 侧则让 proposal 和 implementation blocks 由 task package 自己声明。这样 composed run 不再靠 TIDMAD fallback 猜语义。\n\n它还守住了两个边界。第一，老的 uncomposed Regime-A 路径保持原样，不因为这次泛化改造被顺手改坏。第二，旧 composed workspace 如果是在新 blocks 加入前创建的，resume 会被拒绝：因为 task 的 semantic fingerprint 已经变了，继续跑会把两套语义混在一个实验里。这个 fail closed 是保护可比性，不是兼容性事故。\n\n这次没把所有 extensibility 都做完。CAP-SCOPE、external child loading 和后续外部插件生命周期仍留给下一阶段；PR 关闭的是它负责的那些隐式 TIDMAD 语义。",
        "provenance": {"host":"codex","model":"gpt-5","generated_at":"2026-08-28T20:30:00Z","skill_mode":"full","notes":"Applied canonical dongbei-explainer composition at level 2."}
      }
    },
    {
      "id": "siderius-pr-232",
      "title": "SIDERIUS PR #232 — DAVIS executable path and cross-task proof",
      "source": {
        "kind": "pr",
        "url": "https://github.com/Galileo-Sandbox/SIDERIUS/pull/232",
        "revision": "merge 4db414b599bb1a41357ad694f78bceec4f4577e1",
        "snapshot": "Merged integrated D14 stack. DAVIS 2017 future-frame prediction now runs pinned licensed frames through a deterministic clip manifest, the generic production training/inference path, npz deliverables, and GlobalMseMetric. The global MSE implementation is pinned by an unequal-sample test where mean-of-means would be wrong. A real gate trained and scored 15 predictions, slightly beating last-frame copy. Together with TIDMAD and Oxford Pets, the stack demonstrates three tasks with different shapes, objectives, deliverables, and metrics without task-name branches or production dependencies on examples/. The stacked PRs were semantically reviewed separately but the exact integrated stack was merged once."
      },
      "request": "解释这个 PR 为什么不只是‘新增一个 DAVIS example’，它对通用数据路径的证明是什么。",
      "audience": "ML systems engineer familiar with training pipelines",
      "depth": 2,
      "must_preserve": ["real data flows through production training, inference, and scoring", "clip scope is deterministic and leakage is guarded by sequence disjointness", "global MSE differs from mean-of-means", "three-task breadth is evidence against task-name branching", "single-round evidence is not multi-iteration research maturity"],
      "baseline": {
        "text": "PR #232 adds an executable DAVIS future-frame prediction task and completes D14 cross-task validation. It introduces license-verified frame acquisition, deterministic clip manifests, a DAVIS data path, an npz deliverable, and GlobalMseMetric. The reference predictor was trained and evaluated through the production engine, producing 15 predictions and an MSE of 0.017290 versus 0.017392 for last-frame copy. Combined with TIDMAD and Oxford Pets, this validates that the generic architecture supports heterogeneous input/target shapes, objectives, deliverables, and metrics without task-name branches. The integrated three-PR stack was merged once after separate semantic review. This is an executable single-round proof, not evidence of equal multi-iteration maturity across all tasks.",
        "provenance": {"host":"codex","model":"gpt-5","generated_at":"2026-08-28T20:30:00Z","skill_mode":"baseline"}
      },
      "full": {
        "text": "这不是“examples 目录里又多了个视频任务”这么简单。真正要证明的是：换成一种完全不同的数据形状，SIDERIUS 的 production chain 还能不能不改核心逻辑，照样完成训练、推理和评分。\n\nDAVIS 这条链是这样的：先从固定版本的原始帧生成确定性的 clip manifest；train、validation、final 按 sequence 分开，防止同一视频前后片段跨集合泄漏。然后这些 clips 走通用 data-path 接口进入真实训练和 inference，预测结果写成 npz，最后由 `GlobalMseMetric` 评分。这里特意用样本大小不等的测试钉住算法：应该把所有像素误差放在一起算 global mean，不能先对每个样本求 MSE 再平均，不然例子里会把正确的 3.2 算成 2.0。\n\nGate 不是只看接口能不能 import。它真的训练了 reference predictor，产出 15 份预测，MSE 0.017290，略好于 last-frame-copy 的 0.017392。提升很小，但这轮 gate 要证明的是整条生产路径可执行，不是宣称模型多先进。\n\n再把它和 TIDMAD、Oxford Pets 放一块儿看：三者的数据维度、target、objective、deliverable 和 metric 都不同，generic core 里却不需要按 task name 分支，production 也不反向依赖 examples。这个 PR 提供的是“通用 seam 真能承载第三种结构”的实证。它仍只是单轮 executable witness，不代表 DAVIS 已经达到 TIDMAD 的多轮研究成熟度。",
        "provenance": {"host":"codex","model":"gpt-5","generated_at":"2026-08-28T20:30:00Z","skill_mode":"full"}
      }
    },
    {
      "id": "siderius-pr-219",
      "title": "SIDERIUS PR #219 — task-derived measurement and validation pricing",
      "source": {
        "kind": "pr",
        "url": "https://github.com/Galileo-Sandbox/SIDERIUS/pull/219",
        "revision": "merge 52bd98ba1c7c57c39a8e8eef36d05f819513f6ca",
        "snapshot": "Merged PR with two capability blocks. Measurement batches and model-boundary dtype become derived from DatasetProfile and ModelIOContract instead of model-name/TIDMAD branches. Runtime deadlines change from train estimate plus overhead to train plus validation estimates plus overhead. Gate attempt 1 found that validation prediction was persisted only after _validation_pass returned, so the running process never received the refreshed deadline and was killed during validation. A real-sidecar order regression and production fix landed; attempt 3 passed. Admission semantics and prompts were deliberately unchanged."
      },
      "request": "解释这个 PR 的两个改动，以及为什么一万条 unit test 通过后 real gate 还能找到关键 bug。",
      "audience": "senior engineer familiar with runtime watchdogs and ML validation",
      "depth": 3,
      "must_preserve": ["measurement data becomes capability-derived", "deadline must include validation", "the defect was persistence timing, not deadline arithmetic", "unit test used an already-updated synthetic sidecar", "new regression observes real sidecar ordering"],
      "baseline": {
        "text": "PR #219 contains two changes. First, GPU measurement inputs are derived from DatasetProfile and ModelIOContract through a shared bounded probe-batch builder, eliminating model-name branches and TIDMAD_DATA_DIR usage in runtime control. Second, runtime deadline estimation becomes T_deadline = T_train + T_val + overhead + margin. Gate 2 exposed a persistence-order defect: _validation_pass updated prediction state only after returning, so the watchdog sidecar lacked the validation term while the pass was running and killed the process using the old deadline. Existing unit tests validated arithmetic against a pre-updated synthetic sidecar, not the write timing. The fix persists the validation estimate during the pass, and a regression reads the real sidecar before completion to assert event order. Attempt 3 passed the full path.",
        "provenance": {"host":"codex","model":"gpt-5","generated_at":"2026-08-28T20:30:00Z","skill_mode":"baseline"}
      },
      "full": {